{
  "jurisdiction": { "country": "us", "region": "KY" },
  "appliesNationally": false,
  "key": "us-ky-kcdpa",
  "title": "Kentucky: Kentucky Consumer Data Protection Act (KCDPA) deletion & opt-out",
  "summary": "Kentucky residents can request deletion of the personal data a business holds and opt out of its sale and targeted advertising. The KCDPA took effect on January 1, 2026.",
  "authorizedAgent": true,
  "disclaimer": "General information, not legal advice, and not yet independently reviewed — verify the current process and your eligibility before relying on it.",
  "lastVerified": "2026-06-01"
}
