{
  "jurisdiction": { "country": "us", "region": "NH" },
  "appliesNationally": false,
  "key": "us-nh-ndpa",
  "title": "New Hampshire: Consumer Data Privacy Act deletion & opt-out",
  "summary": "New Hampshire residents can request deletion of the personal data a business holds and opt out of its sale and targeted advertising, including through a recognized universal opt-out signal. The law took effect on January 1, 2025.",
  "authorizedAgent": true,
  "disclaimer": "General information, not legal advice, and not yet independently reviewed — verify the current process and your eligibility before relying on it.",
  "lastVerified": "2026-06-01"
}
